{
  "schema_version": "runsteward.capability-plan/v1",
  "capability_plan_id": "plan:atomic-initial-gated-01",
  "run_id": "run:atomic-initial-gated-01",
  "bound_at": "2026-07-14T00:01:00Z",
  "choicegate_receipt": {
    "schema_id": "choicegate.decision-receipt/v1",
    "receipt_schema_sha256": "3d32d4bac2cb9ff78d0249741d74e8572326894435e3bab10bf0f2f7ca7c949d",
    "receipt_version": "choicegate.decision-receipt/v1",
    "immutable_ref": "contracts/fixtures/choicegate/cg-initial-gated-01.receipt.json",
    "native_digest_procedure": "choicegate-native-sorted-compact-json-sha256-v1",
    "receipt_sha256": "6ab72c077b77cfb267f2d88e007bc2bd958da7d98bda4378e1a00bb07d948b84",
    "request_id": "runsteward-contract:cg-initial-gated-01",
    "request_sha256": "f89203d699af3773d0d9c7292f18fa13a428488376e50b99f1b47fc836a82132",
    "task_class": "repo-orientation",
    "inventory_fingerprint": "e0e0e0e0e0e0e0e0e0e0e0e0e0e0e0e0e0e0e0e0e0e0e0e0e0e0e0e0e0e0e0e0",
    "accepted_lifecycle_authority_commit": "d0d0d0d0d0d0d0d0d0d0d0d0d0d0d0d0d0d0d0d0",
    "choicegate_commit": "c0c0c0c0c0c0c0c0c0c0c0c0c0c0c0c0c0c0c0c0",
    "qualification_ref": {
      "ref": "contracts/fixtures/choicegate/qualification.initial-gated.json",
      "digest": "sha256:2d3581ded3afdf169c5e53083a8c7570d4a57e15355a0974c882148b113884e8"
    }
  },
  "selected_route": {
    "route_type": "atomic",
    "route_id": "repo-orientation",
    "version": null,
    "owner": "codebase-overview",
    "member_ids": [],
    "executable": true,
    "original_selection_ref": null
  },
  "frozen_preconditions": [],
  "authorization_state": "requires-owner",
  "owner_gates": [
    "approval:initial-local"
  ],
  "fallback": {
    "route_type": "no-safe-route",
    "route_id": "NO_SAFE_ROUTE",
    "reason": "no-eligible-registered-fallback",
    "eligible": true
  },
  "scope_fingerprint": "sha256:69cc9fc6ab9ca535543e8257f69200cf546b890ff8794d1913689e401f2159c6",
  "plan_digest": "sha256:4659422e29c2e4e3e3128c48d5b3ffd8b9741cf044bf011ec56ef3eea8132c82"
}
